"WALLACE, Robert John",V. Occasional consultancy,,"CSIRO - Commonwealth Scientific and Industrial Research Organisation, Australia's national science agency",Evaluator/adviser on project aiming to mitigate methane emissions in sheep. Not relevant to EFSA activities/responsibilities. Time spent so far (until May 2015) was 20 h. The research plan was revised in the light of my recommendations.,2010-01,now,2015-10-01,FEEDAP_doi_018.pdf
"WALLACE, Robert John",V. Occasional consultancy,,"Harbro (Scotland's biggest feed compounder), UNITED KINGDOM","I provide advice on ruminant nutrition and feed additives that modify rumen function and prevent acidosis. Advice is broadly based, on mode of action vs microorganisms, not safety or efficacy. 20 h p.a.",2010-01,2014-08,2015-10-01,FEEDAP_doi_018.pdf
"WALLACE, Robert John",V. Occasional consultancy,,Enterprise Ireland,"Evaluator of research proposals on ruminant nutrition and the development of feed additives. Broad advice, not relating to efficacy or safety, was given. 10 h. One-off contract.",2010-05,2010-06,2015-10-01,FEEDAP_doi_018.pdf
"WALLACE, Robert John",V. Occasional consultancy,,"Department for Environment, Food and Rural Affairs (UK government)",I advised on and evaluated UK government department research projects. Not relevant to EFSA activities/responsibilities. 6 h p.a.,2011-01,2011-01,2015-10-01,FEEDAP_doi_018.pdf
"WALLACE, Robert John",V. Occasional consultancy,,"Chr Hansen, DENMARK","Advisory on probiotics research; providing advice on discovering feed additives to combat sub acute ruminal acidosis; resulted in a grant proposal to discover new probiotic feed additives. This is about discovery, not development. Chr Hansen produces inoculants and enzymes for the cheese industry, other enzymes, and probiotics. It does not produce amino acids or vitamins. 10 h p.a.",2011-03,2014-08,2015-10-01,FEEDAP_doi_018.pdf
"WALLACE, Robert John",V. Occasional consultancy,,Biotechnology and Biological Sciences Research Council,"Programme adviser, IBERS. Evaluator of proposed ruminant nutrition/microbiology research programme. Not relevant to EFSA activities/responsibilities. 20 h p.a.",2011-05,now,2015-10-01,FEEDAP_doi_018.pdf
"WALLACE, Robert John",V. Occasional consultancy,,"Meat & Livestock Agency, Australia","Review of Australian methane research. 30 h over one month, single contract.",2013-08,2013-09,2015-10-01,FEEDAP_doi_018.pdf
"WALLACE, Robert John",V. Occasional consultancy,,"European Commission, Brussels, BELGIUM","Evaluator, RIA Actions, Horizon 2020. 80 h p.a. One week of daily meetings, five virtual meetings.",2014-06,now,2015-10-01,FEEDAP_doi_018.pdf
"WALLACE, Robert John",V. Occasional consultancy,,"UK Research Councils (NA), NA, NA, UNITED KINGDOM",Evaluation of research grant proposals. 5 h p.a. Areas of microbiology and applied biology.,2014-11,now,2015-10-01,FEEDAP_doi_018.pdf
"WESTER, Pieter",V. Occasional consultancy,,"DG SANCO, Expert working group contaminants in food",Member expert working group on contaminants in food. Preparation and discussion with member states on SANCO draft proposals on contaminants in food for decision in SCOFCAH. No voting.,2006-01,2012-05,2015-09-10,FEEDAP_doi_019.pdf
"WESTER, Pieter",V. Occasional consultancy,,"SANCO, member expert group health claims on food","Assessement of health claims made on food in the context of Regulation (EC) 1924/2006, after been assessed by the EFSA NDA panel. Preparation of draft proposals for SCOFCAH. No voting, no relationship with Panel issues.",2009-04,2010-07,2015-09-10,FEEDAP_doi_019.pdf
"BIRCH, Andrew Nicholas",V. Occasional consultancy,,"Koppert Biological systems Ltd, Koppert Ltd, Rotterdam, NETHERLANDS","Biocontrol and IPM in soft fruit. Koppert Biological Systems (UK and Netherlands) develop and market biocontrol products for a range of crops. Their role was to provide in kind biocontrol agents for IPM research at JHI. My role was as an unpaid advisor on biocontrol for soft fruit grown in polytunnels and open fields, approximately for 2 days per year. This consultancy was not related to GMOs.",2010-03,2015-01,2015-07-28,GMO_doi_000.pdf
"CASACUBERTA, Josep",V. Occasional consultancy,,,NO INTEREST,,,2015-09-29,GMO_doi_001.pdf
"DE SCHRIJVER, Adinda",V. Occasional consultancy,,,NO INTEREST,,,2015-09-29,GMO_doi_002.pdf
"GATHMANN, Achim",V. Occasional consultancy,,,NO INTEREST,,,2015-09-29,GMO_doi_003.pdf
"GRALAK, Mikolaj Antoni",V. Occasional consultancy,,,NO INTEREST,,,2015-09-29,GMO_doi_004.pdf
"GUERCHE, Philippe",V. Occasional consultancy,,,NO INTEREST,,,2015-08-03,GMO_doi_005.pdf
"JONES, Huw",V. Occasional consultancy,,,NO INTEREST,,,2015-07-28,GMO_doi_006.pdf
"MANACHINI, Barbara",V. Occasional consultancy,,,NO INTEREST,,,2015-09-20,GMO_doi_007.pdf
"MESSEAN, Antoine",V. Occasional consultancy,,,NO INTEREST,,,2015-11-10,GMO_doi_008.pdf
"NAEGELI, Hanspeter",V. Occasional consultancy,,,NO INTEREST,,,2015-07-28,GMO_doi_009.pdf
"NIELSEN, Elsa Ebbesen",V. Occasional consultancy,,,NO INTEREST,,,2015-11-03,GMO_doi_010.pdf
"NOGUE, Fabien",V. Occasional consultancy,,,NO INTEREST,,,2015-09-29,GMO_doi_011.pdf
"ROBAGLIA, Christophe",V. Occasional consultancy,,,NO INTEREST,,,2015-07-31,GMO_doi_012.pdf
"ROSTOKS, Nils",V. Occasional consultancy,,,NO INTEREST,,,2015-07-29,GMO_doi_013.pdf
"SWEET, Jeremy",V. Occasional consultancy,,Agrisci DK. Public agricultural research organisation,Work on Danish Coexistence Document.,2003-01,2011-01,2015-08-13,GMO_doi_014.pdf
"SWEET, Jeremy",V. Occasional consultancy,,"UN, FAO, EU, ICGEB and UNIDO",Consultancy work and training on Risk assessment and co-existence of GMOs in various countries. Includes EU BTSF training programmes.,2004-01,now,2015-08-13,GMO_doi_014.pdf
"SWEET, Jeremy",V. Occasional consultancy,,NIAB Cambridge UK. Private Charitable Trust agricultural research organisation,Consultancy work on GMOs NO WORK COMMISSIONED BY PRIVATE COMPANIES,2004-01,now,2015-08-13,GMO_doi_014.pdf
"SWEET, Jeremy",V. Occasional consultancy,,"UNEP, United Nations Environment Programme (UNEP)","Consultant to Royal Bhutan Government Ministry of Agriculture and Forests, to provide expert advice for the establishment and development of risk assessment/risk management manuals/guidelines and to provide trainings to strengthen capacity in the area of risk assessment and risk management under the Bhutan Biosafety regulations. THERE ARE CURRENTLY NO APPLICATIONS TO IMPORT GMOS OR THEIR PRODUCTS INTO BHUTAN so this is in preparation for future applications to import GM plant products.",2013-09,now,2015-08-13,GMO_doi_014.pdf
"SWEET, Jeremy",V. Occasional consultancy,,"Polytechnic University of Marche, Italy, Ancona",Visiting Scientist involved in lecturing on biosafety aspects of biotechnology to post-graduate students and developing research proposals,2014-04,now,2015-08-13,GMO_doi_014.pdf
"TEBBE, Christoph",V. Occasional consultancy,,,NO INTEREST,,,2015-07-30,GMO_doi_015.pdf
"VISIOLI, Francesco",V. Occasional consultancy,,"Nutrition Foundation of Italy (NFI), Nutrition Foundation of Italy, Milan, ITALY","Contribution to website. Occasional (foreseen: once every two/three years) co-organization of meetings. Writing of monographs for the NFI website. Follow up of literature on nutritional ingredients of interest to NFI members, notably chocolate, coffee, alcohol, tea.",2014-11,now,2015-09-30,GMO_doi_016.pdf
"WAL, Jean-Michel",V. Occasional consultancy,,,NO INTEREST,,,2015-09-29,GMO_doi_017.pdf
"DAVIES, Sue",V. Occasional consultancy,,"EU Platform for Action on Diet, Physical Activity and Health","Multi-stakeholder group developing voluntary commitments to tackle obesity and diet-related disease. Represent BEUC, the European Consumer Organisation.",2005-03,now,2015-09-07,MB_doi_000.pdf
"DAVIES, Sue",V. Occasional consultancy,,Council of Food Policy Advisors,"Advising the Secretary of State for the Environment, Food and Rural Affairs on how to achieve sustainable production, distribution and consumption of food",2008-12,2010-08,2015-09-07,MB_doi_000.pdf
"DAVIES, Sue",V. Occasional consultancy,,Science for All Expert Group,Advisory body reporting to the UK Science Minister on public engagement around science issues.,2009-07,2010-02,2015-09-07,MB_doi_000.pdf
"DAVIES, Sue",V. Occasional consultancy,,"Defra (UK Department for the Environment, Food and Rural Affairs) Food Strategy Delivery Group",small multi- stakeholder group advising the department on its delivery plan for a cross-cutting food strategy for England,2010-05,2011-06,2015-09-07,MB_doi_000.pdf
"DAVIES, Sue",V. Occasional consultancy,,Food Standards Agency Current and Future Meat Controls Stakeholder Group,Multi-stakeholder group advising government on changes to meat inspection.,2010-09,2012-06,2015-09-07,MB_doi_000.pdf
"DAVIES, Sue",V. Occasional consultancy,,Scottish Government Health and Environmental Sustainability Framework Expert,multi-stakeholder group advising the Scottish Government on how health and broader food sustainability issues can be integrated,2010-09,2011-04,2015-09-07,MB_doi_000.pdf
"DAVIES, Sue",V. Occasional consultancy,,UK Department of Health Responsibility Deal Food Network Steering Group,Multi-stakeholder group looking at actions to address obesity and poor diet,2010-10,now,2015-09-07,MB_doi_000.pdf
"DAVIES, Sue",V. Occasional consultancy,,Department of Health Responsibility Deal Plenary Group,"Member of a multi-stakeholder group, representing Which?, inputting into the government's Public Health Responsibility Deal.",2011-07,now,2015-09-07,MB_doi_000.pdf
"DAVIES, Sue",V. Occasional consultancy,,Expert Panel on Food Standards in Scotland,Advising Scottish Ministers on options for the future of the Food Standards Agency and meat hygiene delivery in Scotland.,2011-07,2012-04,2015-09-07,MB_doi_000.pdf
"DAVIES, Sue",V. Occasional consultancy,,"Department for the Environment, Food and Rural Affairs Green Food Project Steering Group",Member of mult-stakeholder steering group advising on the UK Government's Green Food Project which is looking at how to produce more food sustainably.,2011-09,2013-04,2015-09-07,MB_doi_000.pdf
"DAVIES, Sue",V. Occasional consultancy,,Scottish Government,Expert Panel advising on the implications of the horse meat incident for the new Scottish food agency.,2013-04,2013-12,2015-09-07,MB_doi_000.pdf
"DAVIES, Sue",V. Occasional consultancy,,Department of Health Obesity Review Group,Member of an Expert Group chaired by the UK Public Health Minister reviewing progress on tackling obesity.,2013-06,now,2015-09-07,MB_doi_000.pdf
"EGUILEOR, Inaki",V. Occasional consultancy,,,NO INTEREST,,,2015-05-22,MB_doi_001.pdf
"FACELLI, Piergiuseppe",V. Occasional consultancy,,Office International des Epizooties (OIE),Certified assessor of Performance of Veterinary Services - PVS,2008-01,now,2015-09-02,MB_doi_002.pdf
"MICHAELIDOU-CANNA, Stella",V. Occasional consultancy,,State general laboratory,Advice to Various Ninisries and technical support on issues of Food Safety and Environment and Health as well Risk Assessment and Communication,1991-12,2009-12,2014-12-01,MB_doi_004.pdf
"MICHAELIDOU-CANNA, Stella",V. Occasional consultancy,,EFSA,EFSA PPR Panel,2006-12,2009-12,2014-12-01,MB_doi_004.pdf
"MICHAELIDOU-CANNA, Stella",V. Occasional consultancy,,Member DG Sancco - SCHER,"Risk assesment on health and environmental Risk, Scientific Opinion and advice",2009-06,2013-03,2014-12-01,MB_doi_004.pdf
"MIKO, Ladislav",V. Occasional consultancy,,,NO INTEREST,,,2015-03-16,MB_doi_005.pdf
"MOUSING, Jan",V. Occasional consultancy,,,NO INTEREST,,,2015-05-28,MB_doi_003.pdf
"O'ROURKE, Raymond",V. Occasional consultancy,,"Icon, Koln, Germany",EU technical assistance project in St. Lucia. Drafted a Food Jurisdictional Law and various Food Standards for the St Lucia Bureau of Standards,2009-04,2009-11,2015-09-19,MB_doi_006.pdf
"O'ROURKE, Raymond",V. Occasional consultancy,,"Bord Bia, Ireland",Legal advice on Bord Bia's Quality Assurance Schemes,2010-02,2010-04,2015-09-19,MB_doi_006.pdf
"O'ROURKE, Raymond",V. Occasional consultancy,,"Agrotec, Rome, Italy",EU technical assistance project in Albania. Gave legal advice & drafted a new Veterinary Law and secondary legislation in line with the EU acquis communitaire,2010-04,2013-07,2015-09-19,MB_doi_006.pdf
"O'ROURKE, Raymond",V. Occasional consultancy,,BWG Ltd. Ireland,Legal advice on the labelling of numerous food products sold under the SPAR label in Ireland,2010-09,2010-11,2015-09-19,MB_doi_006.pdf
"O'ROURKE, Raymond",V. Occasional consultancy,,Country Markets Ltd,Legal advice to a co-operative organising country markets throughout Ireland every week. Work has been completed by means of a Hygiene Guide published by the Food Sfaety Authority of Ireland (FSAI),2011-01,2015-05,2015-09-19,MB_doi_006.pdf
"O'ROURKE, Raymond",V. Occasional consultancy,,"Agrotec, Rome, Italy",EU technical assistance project in Montenegro. Drafted legislation on classical swine fever & rabies in line with EU acquis communitaire,2011-01,2012-11,2015-09-19,MB_doi_006.pdf
"O'ROURKE, Raymond",V. Occasional consultancy,,Northwest Natural Products,Legal advice to a North American company on the labelling of food supplements for export to the EU,2011-02,2011-03,2015-09-19,MB_doi_006.pdf
"O'ROURKE, Raymond",V. Occasional consultancy,,Qatar National Food Security Programme (QNFSP),Drafted a new Food Safety Law and gave advice on the establishment of a Qatar Food Safety Authority,2012-02,2012-12,2015-09-19,MB_doi_006.pdf
"O'ROURKE, Raymond",V. Occasional consultancy,,"Kelkin Ltd, Ireland",Legal advice on the labelling of food products (breakfast cereals) and food supplements,2012-10,2012-12,2015-09-19,MB_doi_006.pdf
"O'ROURKE, Raymond",V. Occasional consultancy,,"West Cork Distillers Ltd, Ireland",Legal advice on an application to get approval to produce Irish Whiskey,2012-12,2013-03,2015-09-19,MB_doi_006.pdf
"O'ROURKE, Raymond",V. Occasional consultancy,,"GFA, Hamburg, GERMANY",EU Market Surveillance project in Serbia. Drafted EU-compliant laws on Organic Food & Food Contact Materials.,2013-03,2013-10,2015-09-19,MB_doi_006.pdf
"O'ROURKE, Raymond",V. Occasional consultancy,,"Transtec, Brussels, BELGIUM",EU- Indonesia Trade Support Project. Gave legal advice and completed three 2-day Workshops on EU Rules on Exporting Food Products to the EU.,2013-08,2013-09,2015-09-19,MB_doi_006.pdf
"O'ROURKE, Raymond",V. Occasional consultancy,,"Cardno, Brussels, BELGIUM","EU-China Trade Project II - provided legal advice and completed a Workshop on Food Safety Liability Insurance (Beijing, China)",2014-01,2014-02,2015-09-19,MB_doi_006.pdf
"O'ROURKE, Raymond",V. Occasional consultancy,,"GFA, Hamburg, GERMANY",EU Trade Policy project in Kosovo. Provided technical assistance to Kosovo Food & Veterinary Agency and Kosovo Ministry of Agriculture on plant health and food labelling issues.,2014-04,2014-06,2015-09-19,MB_doi_006.pdf
"O'ROURKE, Raymond",V. Occasional consultancy,,"DMI Associates, Lyon, FRANCE",EU Technical Assistance project - PLAC - in Serbia. Drafting EU compliant laws on Food Contact Materials and Nutrition & Health Claims,2014-06,2014-10,2015-09-19,MB_doi_006.pdf
"O'ROURKE, Raymond",V. Occasional consultancy,,"Agrotec, Rome, ITALY",EU Technical Assistance PAZA-2 project in Albania in the area of food & veterinary affairs. Legal Drafting advice,2014-10,now,2015-09-19,MB_doi_006.pdf
"O'ROURKE, Raymond",V. Occasional consultancy,,"GFA, Hamburg, GERMANY",EU Trade Policy project in Kosovo. Further technical assistance to Kosovo Food & Veterinary Agency and Kosovo Ministry of Agriculture on plant health and food labelling issues as a follow-up to work completed in 2014,2015-05,2015-09,2015-09-19,MB_doi_006.pdf
"PRATS MONNE, Xavier",V. Occasional consultancy,,,NO INTEREST,,,2015-10-06,MB_doi_010.pdf
"ROATIS, Radu",V. Occasional consultancy,,,NO INTEREST,,,2014-11-24,MB_doi_013.pdf
"RUPRICH, Jiri",V. Occasional consultancy,,EFSA,DPPA/EFSA/DATEX/2008/01 - Compilation of existing individual food consumption data collected within the most recent national dietary surveys in Europe - Czech Rep.,2008-10,2009-11,2014-10-11,MB_doi_007.pdf
"SZEKACS, Andras",V. Occasional consultancy,,"Ministry of Agriculture, Hungary","In certain occasions, delegated environmental expert of the Ministry (earlier Ministry of Rural Development and its predecessor Ministry of the Environment and Water). Participation is voluntary and non- honorary. In this competency, the Ministry has occasionally delegated me, selected as an independent researcher of the Hungarian Academy of Sciences or later the National Agricultural Research and Innovation Centre, to: - EFSA discussion meetings at Parma and Brussels (re-registration of MON 810, discussion of EFSA ERA guidelines on GMOSs) - the Open ended Expert Group on Risk Assessment and Risk Managment of LMOs (GMOs) to the Cartagena Biosafety Protocol - OECD Co-operatice Research Programme (CRP) Governing Body, delegate (04/2011 - now); Scientific Advisory Body, member (12/2014 – now) My participation at these events have been advisory and did not include formal membership in Standing Committees.",2001-09,now,2015-08-13,MB_doi_008.pdf
"VAN GORCOM, Robert",V. Occasional consultancy,,,NO INTEREST,,,2015-03-27,MB_doi_009.pdf
"VANHOORDE, Robert",V. Occasional consultancy,,,NO INTEREST,,,2015-03-17,MB_doi_011.pdf
"VANTHEMSCHE, Piet",V. Occasional consultancy,,,NO INTEREST,,,2014-12-08,MB_doi_012.pdf
"WIJASZKA, Tadeusz",V. Occasional consultancy,,,NO INTEREST,,,2015-03-06,MB_doi_014.pdf
"WINTER, Michael",V. Occasional consultancy,,,NO INTEREST,,,2015-05-28,MB_doi_015.pdf
"BRESSON, Jean-Louis",V. Occasional consultancy,,Syndifrais (Fermented milk producers intersyndicate),"Bid and appraisal of call for tenders for scientific research projects about probiotic mechanisms of action and human microbiota effects on host. With colleagues, I am discussing the aim of the research, the methods chosen to carry it out and its timescale. The decision to select a project is a collective one. The work carried out relates to a starter culture model (model symbiosis S85), which is only used for research in order to exclude any competitive/commercial interest. By construction, this inter-syndicate strictly rules out the use of bacteria which are or could be utilised for commercial purposes. Meetings are held to define the terms of the call, select the best applications, meet face to face the applicants to refine the projects and follow up the progress reports (about 4/year). The follow up of the research projects implies meeting and auditing the public research teams which have been funded, in order to make sure that the proposed work is satisfactorily carried out. As the results have been obtained by using a non commercial starter culture, they cannot be used to support allegations related to other bacteria. Besides, most studies are related to very basic biological mechanisms or to methodological issues in microbiology and not to studies in vivo in humans. Syndifrais comprises local and multinational producers.",2010-01,now,2015-10-26,NDA_doi_000.pdf
"BRESSON, Jean-Louis",V. Occasional consultancy,,Merck,"Discussion of methodological issues related to clinical trials. Actually, there were only two meetings (half a day in April 2011 and half a day in June 2012) dealing with independent issues.",2011-04,2012-06,2015-10-26,NDA_doi_000.pdf
"BRESSON, Jean-Louis",V. Occasional consultancy,,Senoble,Discussion of methodological issues related to clinical trials.,2011-04,2011-04,2015-10-26,NDA_doi_000.pdf
"BURLINGAME, Barbara",V. Occasional consultancy,,,NO INTEREST,,,2015-05-05,NDA_doi_001.pdf
"DEAN, Tara",V. Occasional consultancy,,,NO INTEREST,,,2015-11-23,NDA_doi_002.pdf
"FAIRWEATHER-TAIT, Susan",V. Occasional consultancy,,,NO INTEREST,,,2015-10-28,NDA_doi_003.pdf
"HEINONEN, Marina",V. Occasional consultancy,,,NO INTEREST,,,2015-10-05,NDA_doi_004.pdf
"HIRSCH-ERNST, Karen Ildico",V. Occasional consultancy,,,NO INTEREST,,,2015-10-23,NDA_doi_005.pdf
"MANGELSDORF, Inge",V. Occasional consultancy,,,NO INTEREST,,,2015-10-05,NDA_doi_006.pdf
"MCARDLE, Harry",V. Occasional consultancy,,"International Copper Association (ICA), New York, UNITED STATES","Provided scientific advice for the preparation of a REACH document for the European Commission. This work involved several meetings, in Europe (Rome, since Italy was the reporting country, Belgium and the UK, since Birmingham University were the primary preparers of the dossier) and the USA, since ICA was based in the US. The REACH document was submitted in 2010 by the European Copper Institute. This work resulted in a publication in a refereed journal (Verougstraate et al, JTEH, 2010, 73:101-107. This work is now completed.",2000-01,2010-04,2015-09-25,NDA_doi_007.pdf
"MCARDLE, Harry",V. Occasional consultancy,,"International Molybdenum Association (IMOA), London, UNITED KINGDOM",Provided advice on role of molybdenum in human biology. gave information on research gaps and possible future research projects. This was a single meeting followed by some telephone calls. The work is now completed.,2013-12,2014-02,2015-09-25,NDA_doi_007.pdf
"NASKA, Androniki",V. Occasional consultancy,,,NO INTEREST,,,2015-07-23,NDA_doi_008.pdf
"NEUHÄUSER-BERTHOLD, Monika",V. Occasional consultancy,,,NO INTEREST,,,2015-09-25,NDA_doi_009.pdf
"NOWICKA, Grazyna",V. Occasional consultancy,,,NO INTEREST,,,2015-09-18,NDA_doi_010.pdf
"PENTIEVA, Kristina",V. Occasional consultancy,,,NO INTEREST,,,2015-09-21,NDA_doi_011.pdf
"SANZ, Yolanda",V. Occasional consultancy,,,NO INTEREST,,,2015-09-28,NDA_doi_012.pdf
"SIANI, Alfonso",V. Occasional consultancy,,,NO INTEREST,,,2015-11-03,NDA_doi_013.pdf
"SJODIN, Anders Mikael",V. Occasional consultancy,,"Swedish Nutrition Foundation, SWEDEN","Since March 2008 I have been engaged in a programme for self regulation of health claims on foods in Sweden as ""Livsmadelsbranchens granskningsman"" (LGM) A trade initiative (non-govermental initiative) originally introduced 1990, called “The food sector’s code of practice for health claims in the labelling and marketing of food products” (www.snf.ideon.se). This is administrated by the Swedish Nutrition Foundation (SNF) and jointly financed by the Swedish Food Federation and Swedish Food Retailers Federation. My function is to audit and identify when commercial actors on the Swedish food market is not complying with relevant legislation for nutrition and health claims in marketing of foods and give recommendations to apply with this regulation.",2008-12,2014-09,2015-09-24,NDA_doi_014.pdf
"STERN, Martin",V. Occasional consultancy,,,NO INTEREST,,,2015-11-23,NDA_doi_015.pdf
"TOMÉ, Daniel",V. Occasional consultancy,,,NO INTEREST,,,2015-09-21,NDA_doi_016.pdf
"TURCK, Dominique",V. Occasional consultancy,,,NO INTEREST,,,2015-10-22,NDA_doi_017.pdf
"VAN LOVEREN, Henk",V. Occasional consultancy,,,NO INTEREST,,,2015-11-23,NDA_doi_018.pdf
"VINCETI, MARCO",V. Occasional consultancy,,,NO INTEREST,,,2015-09-22,NDA_doi_019.pdf
"WILLATTS, Peter",V. Occasional consultancy,,"Mead Johnson Nutrition, Private Organisation","Development of a PowerPoint presentation on general information about infant and child cognitive development and the role of nutrition in development. The presentation was addressed to Health Care Professionals. It involved attending two meetings to discuss the project with three paediatricians from Europe (03/2008). Last year (half day in 08/2014), the expert was asked to review and edit a revised version of the presentation which had been completed by another paediatrician.",2008-03,2014-08,2015-09-21,NDA_doi_020.pdf
"WILLATTS, Peter",V. Occasional consultancy,,"Abbott UK Ltd., Private Organisation",Advice provided on suitable infant cognitive assessments in a planned trial of the effects of nutrition on infant cognitive development.,2011-04,2011-08,2015-09-21,NDA_doi_020.pdf
"BRAGARD, Claude",V. Occasional consultancy,,,NO INTEREST,,,2015-10-06,PLH_doi_000.pdf
"CAFFIER, David",V. Occasional consultancy,,French Ministry of Agriculture and Fisheries,"Consultant delegated by the ministry for EU funded 'twinning programmes' (PHARE, MEDA) and technical assistance programmes for accession countries. Information transfer and education regarding implementation of the EU acquis related to plant health, laboratories, containnment of quarantine organisms, quality assurance. No risk management duties involved. Fees charged by the ministy according to EU procurement rules.",1997-01,2010-06,2015-10-01,PLH_doi_001.pdf
"CAFFIER, David",V. Occasional consultancy,,"Comité français d’accréditation COFRAC, French Committee for Accreditation","COFRAC is an independant body in charge of accreditation (norm ISO 17025) in France. I am Auditor and audit team leader in charge of accreditation following ISO 17025, i.e. laboratory accreditation. Speciality plant health/bacteriology (programme 158). Tasks include evaluation of laboratories according to international standards and to COFRAC's rules, production of evaluation reports given to COFRAC, which manages the decision regarding accreditation. I am remunerated by COFRAC for these audit missions (1 to 2 missions per year on average).",2004-01,now,2015-10-01,PLH_doi_001.pdf
"CAFFIER, David",V. Occasional consultancy,,"Belgische Accreditatie- instelling BELAC, Belgian Organisation of Accreditation, Brussels, Belgium","Auditor in charge of accreditation following ISO 17025, i.e. laboratory accreditation. Evaluation of a laboratory according to international standards (norm ISO 17025 for instance) and to BELAC's rules. Production of an evaluation report given to BELAC, which manages the decision regarding accreditation. I was remunerated by BELAC for these audit missions (2 missions in total).",2004-01,2011-05,2015-10-01,PLH_doi_001.pdf
