Full name,Nature of activity,Activity of a close family member,Organisation,Subject matter,Start date,End date,DOI date,PDF
"BICOUT, Dominique",V. Occasional consultancy,,"ANSES, Agence nationale de sécurité sanitaire de l'alimentation, de l'environnement et du travail, FRANCE, Maisons- Alfort","1. Member of the Committee of Specialised Experts REACH (CES REACH) at the ANSES, Paris, France 2. since 2014: Member of the Programme Committee for Scientific Research (CSPR), ANSES, Paris, France",2013-01,now,2015-07-12,AHAW_doi_000.pdf
"BICOUT, Dominique",V. Occasional consultancy,,"Institut des Systèmes Complexes Rhodanien (www.ixxi.fr) (IXXI), Rhodanien Complex Systems Institute, Lyon, FRANCE",Chairman of the Steering Committee IXXI,2013-01,now,2015-07-12,AHAW_doi_000.pdf
"BUTTERWORTH, Andrew",V. Occasional consultancy,,,NO INTEREST,,,2015-04-25,AHAW_doi_001.pdf
"BØTNER, Anette",V. Occasional consultancy,,,NO INTEREST,,,2015-05-18,AHAW_doi_002.pdf
"CALISTRI, Paolo",V. Occasional consultancy,,,NO INTEREST,,,2015-04-24,AHAW_doi_003.pdf
"DEPNER, Klaus",V. Occasional consultancy,,EUROPEAN COMMISSION,"Advisory activities and task force expert for the EC (DG-SANCO) on CSF, ASF and FMD. Member of the Community Veterinary Emergency Team (DG-SANCO); Expert missions on CSF to Latvia in 2013 and expert missions on ASF to the Baltic States and Poland in 2014.",2010-06,now,2015-04-27,AHAW_doi_004.pdf
"EDWARDS, Sandra",V. Occasional consultancy,,,NO INTEREST,,,2015-10-08,AHAW_doi_005.pdf
"GARIN-BASTUJI, Bruno",V. Occasional consultancy,,"OIE (OIE), World Organisation for Animal Health, Paris, FRANCE",Working groups on Brucellosis and Tuberculosis Expertise of Diagnostic Reagent OIE Registration. Participation à des colloques internationaux (OIE Focal point meetings notamment).,1991-01,now,2015-04-27,AHAW_doi_006.pdf
"GARIN-BASTUJI, Bruno",V. Occasional consultancy,,"FAO (FAO), FAO, Rome, ITALY","FAO Consultancy missions on Brucellosis in Algeria, Morocco, Bosnia-Herzegovina and Thailand.",1992-01,2014-03,2015-04-27,AHAW_doi_006.pdf
"GARIN-BASTUJI, Bruno",V. Occasional consultancy,,"WHO (WHO), WHO, Geneva, SWITZERLAND","Expert meeting in WHO HQ Geneva Consultancy missions in Mongolia, Oman and Tunisia",1992-01,2003-12,2015-04-27,AHAW_doi_006.pdf
"GARIN-BASTUJI, Bruno",V. Occasional consultancy,,"IAEA (IAEA), IAEA, Vienna, AUSTRIA","IAEA consultancy misison, Scientific and technical support to the implementation of an ELISA-based serological survey in small ruminants brucellosis (Tunisia)",1997-12,1998-11,2015-04-27,AHAW_doi_006.pdf
"GARIN-BASTUJI, Bruno",V. Occasional consultancy,,"European Commission DG Sanco (EC - DG SANCO), EC - DG SANCO, Brussels, BELGIUM",Brucellosis Expert group of the Task Force for monitoring disease eradication.,2000-01,now,2015-04-27,AHAW_doi_006.pdf
"GARIN-BASTUJI, Bruno",V. Occasional consultancy,,"Food and Veterinary Office (FVO), FVO, Dublin, IRELAND",2 inspection missions (external expert) in Ireland (06/2002) and Cyprus (06-07/2003),2002-01,2003-12,2015-04-27,AHAW_doi_006.pdf
"GARIN-BASTUJI, Bruno",V. Occasional consultancy,,"EFSA (EFSA), EFSA, Parma, ITALY","Working Group on Bovine, ovine and caprine brucellosis Brucellosis (2005-2006). Working group on Porcine brucellosis (2008-2009).",2005-01,2009-12,2015-04-27,AHAW_doi_006.pdf
"GARIN-BASTUJI, Bruno",V. Occasional consultancy,,"European Commission (EC - DG SANCO), EC - DG SANCO, Brussels, BELGIUM",EURL for Brucellosis,2006-01,2014-06,2015-04-27,AHAW_doi_006.pdf
"GARIN-BASTUJI, Bruno",V. Occasional consultancy,,"INSTITUTO PORTUGUÊS DE ACREDITAÇÃO (IPAC), Portuguese Institue for Accreditation,, 2829-513 Caparica, PORTUGAL",ISO 17025 accreditation audits of the National Laboratory for Veterinary Research (LNIV),2008-01,2011-12,2015-04-27,AHAW_doi_006.pdf
"GARIN-BASTUJI, Bruno",V. Occasional consultancy,,European Commission - DG Health and Consumers,EC Expert Group for the evaluation of Brucellosis co-financed eradication programmes submitted by the EU Member States,2012-05,2014-07,2015-04-27,AHAW_doi_006.pdf
"GARIN-BASTUJI, Bruno",V. Occasional consultancy,,"France Vétérinaire International (FVI), France Vétérinaire International, 69280 MARCY L’ETOILE, FRANCE",Mission d'Expertise concernant le développement du Centre National de Veille Zoosanitaire de Tunis (lutte contre la tuberculose et la brucellose - organisation et missions de l'IRVT),2013-01,2013-12,2015-04-27,AHAW_doi_006.pdf
"GOOD, Margaret",V. Occasional consultancy,,"Commission of the European Communities (EU), Commission of the European Communities, Brussels, BELGIUM",Evaluation of programmes submitted by Member States for EU co- funding for TB and TSE eradication/monitoring,2013-06,now,2015-09-14,AHAW_doi_007.pdf
"GORTAZAR SCHMIDT, Christian",V. Occasional consultancy,,,NO INTEREST,,,2015-05-19,AHAW_doi_008.pdf
"MICHEL, Virginie",V. Occasional consultancy,,,NO INTEREST,,,2015-04-27,AHAW_doi_009.pdf
"MIRANDA, Miguel Angel",V. Occasional consultancy,,,NO INTEREST,,,2015-11-29,AHAW_doi_010.pdf
"MORE, Simon",V. Occasional consultancy,,Department of Agriculture and Rural Development Northern Ireland,"I have occasionally provided scientific advice to DARDNI on a range of animal health and welfare issues. At times, this advice is very specific (providing input into specific potential research projects, including badger prevalence studies). At other times, the discussions are more broad-ranging, focusing on strategies to tackle non-regulatory animal health issues on the island of Ireland and on issues relating to governance of the national TB programmes. In addition, I sit on an government-to-government (Ireland-Northern Ireland) TB/brucellosis committee, sharing scientific information relevant to these two disease eradication programmes. The TB/brucellosis committee meets approximately twice each year, taking a day of my time at each meeting. Performed in a personal capacity.",2008-01,now,2015-07-03,AHAW_doi_011.pdf
"NIELSEN, Søren Saxmose",V. Occasional consultancy,,,NO INTEREST,,,2015-04-23,AHAW_doi_012.pdf
"RAJ, Mohan",V. Occasional consultancy,,CONFIDENTIAL,Welfare of poultry.,2012-03,2012-10,2015-10-06,AHAW_doi_013.pdf
"SIHVONEN, Liisa",V. Occasional consultancy,,,NO INTEREST,,,2015-04-22,AHAW_doi_014.pdf
"SPOOLDER, Hans",V. Occasional consultancy,,,NO INTEREST,,,2015-10-09,AHAW_doi_015.pdf
"STEGEMAN, Jan Arend",V. Occasional consultancy,,Dutch Animal Health Service,"Member of Committee that advises on the research priorities of the Dutch Animal Health Service. Since 2012 these research priorities have been : 1) development of diagnostic platforms that can be used on farms (on site diagnostics), 2) development of markers for robustness in animals, 3) gut health in chickens en 4) development of new diagnostics for antibiotic resistance. ad 1) aimed at production diseases in general, but the advise does not include specific diseases, because it is directed at the technique itself, it will certainly not include notifiable diseases (prohibited for AHS, task of CVI) and also does not include vector borne diseases and there is no plan to include them; ad 2) does not include specific diseases, longevity of cattle is the outcome parameter; ad 3) does also not include specific diseases, because here the challenge is to define a healthy gut (in contrast to gut diseases); ad 4) this aims at identifying new techniques that can more quickly (than bacterial culture) identify antimicrobial resistance in order to chose the right treatment more quickly. In my opinion there has been no overlap between this consultancy and my work for EFSA, neither as a panel member, nor as a member or chair of a WG. To phrase this specifically for the chairing: There has been no overlap with the mandate on Rift Valley Fever, AHS does not have any activity in this area nor is planning one. The consultancy also has never had any involvement with bovine TB. Moreover vector borne diseases have not and will not be part of the consultancy, because that is restricted to the topics listed above and will be for the coming year (by December 2015 the contract will be reevaluated or can be stopped). This advisory task is part of an exchange of services between faculty of veterinary medicine (and consequently actually part of my normal job) and Dutch AHS. Total time spent: committee meets 4-5 times/year, total time spent (including travel and preparation) 5 days/year.",2012-01,now,2015-10-06,AHAW_doi_016.pdf
"THULKE, Hans-Hermann",V. Occasional consultancy,,"EMA, European Medicines Agency, EU / UK, London",Advice on quatitative methodology Two days within five years Application decisions,2010-05,now,2015-11-27,AHAW_doi_017.pdf
"VELARDE, Antonio",V. Occasional consultancy,,IBF International,Help to collect data to to assess implementation of EU legislation on transport of animals,2010-10,2011-03,2015-10-07,AHAW_doi_018.pdf
"VELARDE, Antonio",V. Occasional consultancy,,Organismo internacional regional de sanidad agropecuaria,Scientific support for the development of Regional Standards of Animal Welfare during transport and at slaughter,2011-11,2012-02,2015-10-07,AHAW_doi_018.pdf
"WILLEBERG, Preben",V. Occasional consultancy,,PigCity,"To advise on potential field trials to document the animal health and welfare effects of the proposed PigCity integrated production unit for pigs and tomatoes. I have signed an agreement with the company through COWI Consult A/S, which is in charge of the overall consulting activity for this project, to be paid per hour of service at an agreed rate. This past year I have spent less than 10 hours on this activity.",2011-04,2013-11,2015-07-01,AHAW_doi_019.pdf
"WILLEBERG, Preben",V. Occasional consultancy,,CONFIDENTIAL,"Editing of a risk-analysis report regarding trade in live animals, according to a fully transposed EU legislation. Reviewing a risk- analysis report on import of meat. Ended in 2013.",2012-02,2013-12,2015-07-01,AHAW_doi_019.pdf
"WILLEBERG, Preben",V. Occasional consultancy,,Danish Veterinary and Food Administration,"Participation as one of two experts in a ""service inspection"" of current Danish contingency plans and emergency preparedness procedures for notifiable animal diseases",2012-02,2013-03,2015-07-01,AHAW_doi_019.pdf
"WINCKLER, Christoph",V. Occasional consultancy,,"Vier Pfoten International, Vier Pfoten International, Vienna, AUSTRIA",Scientific support for the development of animal-based measures for the certification of animal-welfare friendly beef production.,2014-09,2015-03,2015-10-09,AHAW_doi_020.pdf
"WINCKLER, Christoph",V. Occasional consultancy,,"BioAustria (BioAustria), BioAustria, Linz, AUSTRIA",Scientific advice for the development of animal-based measures to be used in an animal welfare self-evaluation protocol for organic farmers.,2015-05,2015-08,2015-10-09,AHAW_doi_020.pdf
"AGUILAR, Fernando",V. Occasional consultancy,,,NO INTEREST,,,2015-03-02,ANS_doi_000.pdf
"CREBELLI, Riccardo",V. Occasional consultancy,,Ministry of Health (Superior Council of Health),"Advising activity on genotoxicity of Food contact materials and guideline values for vanadium, lead, arsenic and perfluoro alkyl compounds in drinking water (one to four meetings per year)",2002-01,now,2015-10-19,ANS_doi_001.pdf
"DI DOMENICO, Alessandro",V. Occasional consultancy,,ISS,"Risk and exposure assessment of (persistent) organic chemicals. Risk and exposure assessment of persistent toxic substances, including priority metals. Analytical procedures. The underwriter ceased employment with former employer (see above) for age limit, but is staying with the same institution with an honorary assignment as a sector ""expert"" for support and guidance of scientific research activities. The underwriter has no commitments with other employers.",2010-03,now,2015-11-12,ANS_doi_002.pdf
"DUSEMUND, Birgit",V. Occasional consultancy,,,NO INTEREST,,,2015-10-09,ANS_doi_003.pdf
"FRUTOS FERNANDEZ, Maria Jose",V. Occasional consultancy,,"United States Department of Agriculture (USDA), United States Department of Agriculture, UNITED STATES","Evaluation of Small Business Innovation Research Program (SBIR) projects, to select innovation projects to be funded in this program.",2010-12,2011-02,2015-11-10,ANS_doi_004.pdf
"FRUTOS FERNANDEZ, Maria Jose",V. Occasional consultancy,,"The project management Agency (PT-DLR), Bonn, GERMANY","Evaluation of ERA-Net ERAfrica research proposals as member of the EVAL-INCO expert database, to select the projects to be funded under this program.",2013-08,2013-08,2015-11-10,ANS_doi_004.pdf
"FRUTOS FERNANDEZ, Maria Jose",V. Occasional consultancy,,"Russian International Affairs Council (RIAC), Russian International Affairs Council, Moscow, RUSSIAN FEDERATION",Written assessment of Research proposals submitted to the Russian Science Foundation (RSF) Competition for grants on the priority area of RSF activities “Performing fundamental scientific research and exploratory investigations in high-priority research topic areas”,2015-05,now,2015-11-10,ANS_doi_004.pdf
"GALTIER, Pierre",V. Occasional consultancy,,Comité français de la semoulerie industrielle,"Related to mycotoxins, including zearalenone: provision of scientific advice to the redaction of a guide on good agricultural and industrial practices regardind the presence of chemical contaminants in semolina used in cereal industry. This activity represented a total of six meeting days, of which only one in the period 2009-2010.",2006-11,2010-11,2015-10-11,ANS_doi_005.pdf
"GOTT, David",V. Occasional consultancy,,,NO INTEREST,,,2014-12-19,ANS_doi_006.pdf
"GUNDERT-REMY, Ursula",V. Occasional consultancy,,,NO INTEREST,,,2015-10-08,ANS_doi_007.pdf
"LAMBRÉ, Claude",V. Occasional consultancy,,COFRAC/OECD,"Technical audits and Inspections for the ""Groupe Interministeriel pour les Produits Chimiques"" (GIPC) in the framework of Quality accreditation and Good Laboratory Practice Compliance of Laboratories",2000-01,now,2015-10-13,ANS_doi_008.pdf
"LAMBRÉ, Claude",V. Occasional consultancy,,Algerian Ministry of trade Support for the drafting of a regulatory text on the microbiological,specifications of foods,2011-09,2011-11,2015-10-13,ANS_doi_008.pdf
"LEBLANC, Jean-Charles",V. Occasional consultancy,,DG-SANCO,"invited hearing expert of the AD HOC working group on dietary intake of food additives in the EU. no right to vote, just particpating in given expertise in the field of food exposure additives methodology. Overlap with efsa activities within the ANS Panel exist off course due to personel expertise views on how exposure assemment methodologie need to be made to answer properly to the consumer safety. no involvement in aspartame or any other intense sweeteners",2007-09,2010-09,2015-06-10,ANS_doi_009.pdf
"LEBLANC, Jean-Charles",V. Occasional consultancy,,Food and Agricultural Organization of the United Nations (FAO),"FAO consultant in providing technical expertise on exposure assessment activities to the food safety unit Under the Agriculture and Consumer Protection Department Representing FAO JECFA Secretariat to the codex committee on food additives , 20-28 mars 2015, Xi An china FAO JECFA secretariat for the 80th FAO/WHO meeting, 16 to 28 June 2015, Roma, providing technical support in dietary exposure assessment for additives, enzymes and contaminants on the agenda.",2014-03,now,2015-06-10,ANS_doi_009.pdf
"LINDTNER, Oliver",V. Occasional consultancy,,,NO INTEREST,,,2015-02-09,ANS_doi_010.pdf
"MOLDEUS, Peter",V. Occasional consultancy,,HESI ( ILSI Health and Environmental Science Institute ),I was as representative for AstraZeneca member of HESI Board of Trustiess. That terminated June 2012 and I am no longer involved in this organisation.,2006-01,2012-06,2015-09-21,ANS_doi_011.pdf
"MOLDEUS, Peter",V. Occasional consultancy,,Karolinska Institute,"I am affiliated as Professor of Toxicology at Karolinska Institute, Department of Environmental Medicine but not formally employed. I attend seminars lectures and advisegraduate students about 1 - 2 days per month",2012-06,now,2015-09-21,ANS_doi_011.pdf
"MORTENSEN, Alicja",V. Occasional consultancy,,,NO INTEREST,,,2015-10-09,ANS_doi_012.pdf
"MOSESSO, Pasquale",V. Occasional consultancy,,,NO INTEREST,,,2015-10-21,ANS_doi_013.pdf
"OSKARSSON, Agneta",V. Occasional consultancy,,,NO INTEREST,,,2015-11-06,ANS_doi_014.pdf
"PARENT-MASSIN , Dominique",V. Occasional consultancy,,"ORCHIDEE : MILUPA, PHARMANAGER, CIT","FORMATION AND INFORMATION IN FOOD TOXICOLOGY : lectures, articles, expertises of research project, consultancy in flavours, novel foods, enzymes or botanical food supplements toxicology (details have been provided to EFSA in letter in September 2011, there is no new interest). No consultancy in food additives, nutrient sources or food contaminants",2009-11,2010-12,2015-07-03,ANS_doi_015.pdf
"STANKOVIC, Ivan",V. Occasional consultancy,,,NO INTEREST,,,2015-02-21,ANS_doi_016.pdf
"WAALKENS-BERENDSEN, Ine",V. Occasional consultancy,,,NO INTEREST,,,2015-11-09,ANS_doi_017.pdf
"WOUTERSEN, Rudolf Antonius",V. Occasional consultancy,,,NO INTEREST,,,2015-10-12,ANS_doi_018.pdf
"WRIGHT, Matthew",V. Occasional consultancy,,,NO INTEREST,,,2015-02-02,ANS_doi_019.pdf
"YOUNES, Maged",V. Occasional consultancy,,"World Health Organization, Western Pacific Regional Office, Manila, Philippines","Lead the work of the Regional Office on Food Safety from 1 March till 7 April 2014, particularly assess progress made on implementing the WHO Western Pacific Food Safety Strategy (2011-2015). Outputs are a progress report on country and Regional Office activities, a paper to be presented to the Regional Committee Meeting on the subject, as well as ad hoc advice to individual Member States on specific food safety issues.",2014-03,2014-04,2015-05-13,ANS_doi_020.pdf
"ALLENDE, Ana",V. Occasional consultancy,,"ANEP, Agencia Nacional de Evaluación y Prospectiva (National Evaluation and Foresight Agency ), Spain, National Evaluation and Foresight Agency, Spain",Evaluation committed which assests research projects and proposal to be approved by the MINECO (Spanish Goberment),2014-03,now,2015-11-27,BIOHAZ_doi_000.pdf
"ALLENDE, Ana",V. Occasional consultancy,,"3M, St. Paul, Minnesota, UNITED STATES","To provide one or more educational presentations using my experience and knowledge related to Food Safety. My involvement with this occasional consultancy refers to one presentation which will be held the 5th of October 2015 in Murcia by video conference, where aspects of food safety in primary production will be addressed. Until now, I was not involved in any other lecture and up to now, no future educational prsentations have been agreed. I do not have any role in advising the company on decontamination methods used for foods.",2015-04,now,2015-11-27,BIOHAZ_doi_000.pdf
"BOLTON, Declan",V. Occasional consultancy,,,NO INTEREST,,,2015-04-20,BIOHAZ_doi_001.pdf
"CHEMALY, Marianne",V. Occasional consultancy,,WHO/FAO,"FAO/WHO Expert Meeting on Salmonella and Campylobacter in chicken meat FAO Headquarters, Rome, Italy 4 – 8 May 2009",2009-05,2009-05,2015-04-16,BIOHAZ_doi_002.pdf
"DAVIES, Robert",V. Occasional consultancy,,"British Egg Industry Council (BEIC), London, UK, Meat and Livestock Commission (MLC), Milton Keynes, UK- Agricultural industries Confederation (AIC), London, UK - various producer organisations, veterinarians (e.g. memembers of British Poultry Veterinary Association; Pig Veterianary Society, corporate technical managers","Scientific advice is provided in the areas of hygiene in primary production and during slaughter, farm biosecurity (mainly for Salmonella), and antimicrobial resistance in zoonotic bacteria. The advice provided is not related to any given commercial product, application or process in particular. The advice is provided though my employer (APHA) with the primary aim to support governmental bodies (DEFRA, UK) in implementing the hygiene and zoonoses EU legislation and improving food safety on a National basis. No money is exchanged and no personal profit is involved. The outputs are provided by means of E.mail, telephone conversations or occasional face to face meetings. No study or assessment reports are provided but guidance on where to find published information may be provided. Occasionally I have attended food safety conferences that have been organized by pharmaceutical companies. In these meetings I only present independent scientific data to enhance food safety in primary production, and do not support any particular products. I would be happy to avoid this type of activity in future if there is any conflict with EFSA responsibilities. The organizations may use the publically available UK surveillance data provided or other scientific information to inform their management decisions, e.g. data on detection of live salmonella vaccine strains in surveillance programs. No past or current activity in relation to E.coli or other WG remits. If asked my organisation would be likely to provide advice on methodology and provide molecular typing services to the organisations mentioned. Activity ivolves c. 24 hours per year currently",1995-01,now,2015-06-16,BIOHAZ_doi_003.pdf
"DAVIES, Robert",V. Occasional consultancy,,"Department for Environment Food and Rural Affairs (Defra - London UK), Food Standards Agency (FSA - London, UK), Health and Consumer Protection Directorate General (DG-SANCO - Brussels, Belgium)","Monitoring and control of foodborne zoonoses, hygiene in primary production and at slaughter, biosecurity, animal feed hygiene Topics may include monitoring and control of Salmonella, Campylobacter and antimicrobial resistance and general hygiene in primary production. Outputs take the form of provision of scientific data, scientific opinion, acting as independent scientific expert in working groups on control of Zoonoses (e.g. in UK and EC Zoonoses working groups, EC Zoonoses Task Force that provides scientific advice on salmonella control by means of visits to member states, scientific comments on community hygiene guides, involvement in TAIEX educational activities The advice and information that is provided is taken into account by risk managers and stakeholders, alongside other advice, to help inform their decisions on food hygiene control in primary production As part of consultancy to Defra and research projects I would often request molecular investigations of strains to be carried out by another team in the Department. Other sections of the Bacteriology and Food Safety Department that are not under my control are involved in some commercial development of molecular typing methodologies, arrays etc. I am not involved in this other than to advise on strain selections for validation. This activity has taken place during the last 5 years, is currently active and is likely to be ongoing in future years. I am advisor to a Defra-funded research project that will involve WGS and associated bioinformatics. I occasiionally provide advice on hatchery hygiene or carry out hatchery investigations on behalf og Defra. I am E. coli disease consultant for APHA. All of this consultancy is part of my employement remit and amounts to around 100 hours per year.",1995-01,now,2015-06-16,BIOHAZ_doi_003.pdf
"FERNANDEZ ESCAMEZ, Pablo S.",V. Occasional consultancy,,,NO INTEREST,,,2015-06-29,BIOHAZ_doi_004.pdf
"GIRONES, Rosina",V. Occasional consultancy,,"GRUPO ALIMENTARIO CITRUS, S.L.U. (GAC), CITRUS FOOD GROUP, Ribarroja, Valencia, SPAIN",Study report on the safety of fresh vegetables over the production chain. Used to improve safety and quality of the final product . The dedication is of around 25 hours per year.,2014-01,now,2015-04-20,BIOHAZ_doi_005.pdf
"HERMAN, Lieve",V. Occasional consultancy,,,NO INTEREST,,,2015-09-24,BIOHAZ_doi_006.pdf
"KOUTSOUMANIS, Kostas",V. Occasional consultancy,,,NO INTEREST,,,2015-11-30,BIOHAZ_doi_007.pdf
"LINDQVIST, Roland",V. Occasional consultancy,,,NO INTEREST,,,2015-06-29,BIOHAZ_doi_008.pdf
"NOERRUNG, Birgit",V. Occasional consultancy,,Danish Ministry for Food,"I have beeing involved i consultancy work for Ministry for Food related to management of Salmonella in the Food chain, including investigation of a big Salmonella outbreak in 2008-2009. I participate in ad hoc consultanty work on i.e. Foodborne ourbreaks etc.",2009-02,now,2015-10-21,BIOHAZ_doi_009.pdf
"RICCI, Antonia",V. Occasional consultancy,,,NO INTEREST,,,2015-07-10,BIOHAZ_doi_010.pdf
"ROBERTSON, Lucy",V. Occasional consultancy,,Lucy Robertson Writing Services,Copy editing (language improvement) particularly of scientific articles. This work involves no meetings and is done outside the normal working day (that is during weekends and evenings).,2004-07,now,2015-04-29,BIOHAZ_doi_011.pdf
"RU, Giuseppe",V. Occasional consultancy,,"European Commission, Bruxelles, ITALY","Without any economical compensation, I was asked by the European Commission (Dr- Plantady and coll.) to provide ""informal comments on the applications from Austra and Denmark (2013) and from Finland and Sweden (2014) to be recognised as having a classical scrapie negligible risk status. In particular help was requested in evaluating the requirement that: “for a period of at least seven years, a sufficient number of ovine and caprine animals over 18 months of age, representative of slaughtered, culled or found dead on farm, have been tested annually, to provide a 95 percent level of confidence of detecting classical scrapie if it is present in that population at a prevalence rate exceeding 0,1 percent and no case of classical scrapie has been reported during that period;” The original request was: Would you be willing to provide us with informal comments on this specific point? The consultancy ended by January 2015. (note: as a country in the above field related to the organization (EU Commission"" I entered Italy as the EU is not in the list)",2013-09,2015-01,2015-10-19,BIOHAZ_doi_012.pdf
